{
  "$schema": "../../packages/ppds-kit/schema/plugin-site.schema.json",
  "id": "react-pdf-viewer",
  "name": "React PDF Viewer",
  "tagline": "Accessible, themeable PDF viewer for React, built on PDF.js.",
  "description": "React PDF Viewer is an accessible, themeable PDF viewer for React, built on PDF.js: zoom, search, thumbnails, download and print, with no UI-kit dependency.",
  "categoryId": null,
  "urlPrefix": "",
  "repo": "https://github.com/kiralygyula92/react-pdf-viewer",
  "currentVersion": "1.0.2",
  "versions": [
    {
      "label": "v1.0",
      "href": "/react-pdf-viewer/",
      "current": true,
      "supported": true
    }
  ],
  "tiers": [
    {
      "id": "free",
      "name": "Free",
      "badge": null
    }
  ],
  "links": {
    "issues": "https://github.com/kiralygyula92/react-pdf-viewer/issues",
    "support": "/react-pdf-viewer/getting-started/support/",
    "marketplace": "https://www.npmjs.com/package/@kingtech/react-pdf-viewer",
    "changelog": "/react-pdf-viewer/discover-more/changelog/",
    "roadmap": "/react-pdf-viewer/discover-more/roadmap/",
    "security": "https://github.com/kiralygyula92/react-pdf-viewer/security/advisories/new",
    "license": "https://github.com/kiralygyula92/react-pdf-viewer/blob/main/LICENSE"
  },
  "taxonomy": [
    "Core features",
    "Display & layout",
    "Interaction",
    "Content & data",
    "Connectivity",
    "Developer tools",
    "Advanced features"
  ],
  "sections": [
    {
      "id": "getting-started"
    },
    {
      "id": "features"
    },
    {
      "id": "demos"
    },
    {
      "id": "reference"
    },
    {
      "id": "customization"
    },
    {
      "id": "guides"
    },
    {
      "id": "integrations"
    },
    {
      "id": "resources",
      "enabled": false
    },
    {
      "id": "migration"
    },
    {
      "id": "discover-more"
    },
    {
      "id": "design-resources",
      "enabled": false
    }
  ],
  "referenceSource": {
    "kind": "typescript-declarations",
    "entry": "packages/react-pdf-viewer/src/index.ts",
    "command": "pnpm docs:reference"
  }
}
